어쩌면 = “This is possible, but I’m not confident.”
You’ll almost always see it with possibility expressions:

어쩌면 ~일지도 모르다

어쩌면 ~수도 있다

어쩌면 ~ㄹ/을지도 모르다

Examples

어쩌면 내일 취소될지도 몰라요.

어쩌면 그 말이 사실일 수도 있어요.

Korean	Natural English
어쩌면…	Maybe…
어쩌면 그렇지 않을 수도…	It could be that…
어쩌면 내가 틀렸을지도…	I might be wrong…


만약 내가 공부했으면 시험을 합격했을 것이다,If I studied I would have passed the test
만약 내가 밥을 먹었으면 배고프지 않았을 것이다,If I ate I would not have been hungry
아무리 그 제품을 반값으로 줘도 저는 안 살 거예요,Regardless of if you give me that product at half price I am not going to buy it
어쩌면 그녀가 올지도 몰라요,She might come
어쩌면 그녀의 남자 친구가 그녀를 위해 선물을 살지 몰라요,Her boyfriend might buy her a present
어쩌면 우리가 내일 갈 수 있을지도 몰라요,We might be able to go tomorrow
어쩌면 이렇게 일찍 왔어요?,How is it possible that you came this early?
어쩌면 비가 저렇게 많이 왔어요?,How is it possible that it rained that much?
어쩌면 밥을 그렇게 많이 먹을 수 있어요?,How is it possible that you can eat that much?
어쩌면 시험을 그렇게 잘 봤어요?,How is it possible that you did that well on the exam?
어떻게 이렇게 일찍 왔어요?,How is it possible that you came this early?
어떻게 비가 저렇게 많이 왔어요?,How is it possible that it rained that much?
어떻게 밥을 그렇게 많이 먹을 수 있어요?,How is it possible that you can eat that much?
어떻게 시험을 그렇게 잘 봤어요?,How is it possible that you did that well on the exam?
아무래도 그녀가 우리를 만나러 안 올 것 같아요,She probably will not come to meet us
아무래도 그가 벌써 떠났을 것 같아요,He probably already left
우리가 일어났을 때 아무런 소리도 안 냈어요,When we woke up we did not make any sound
일을 할 때 아무런 문제가 안 생기게 조심하게 하세요,When you work be careful so that no problems occur
남자가 자기 엄마가 죽은 것을 봤을 때 아무런 느낌이 없었어요,When the man saw his mother die he had no feeling
늦게 해도 일이 아무래도 문제가 없을 것 같아요,It probably will not be a problem even if you do it late
일을 아무렇게나 하지 마!,Do not do your work carelessly
4시까지 다 하려고 학생이 숙제를 아무렇게나 하고 선생님께 드렸어요,The student did the homework hastily to finish by four and gave it to the teacher
집에 들어가서 들고 있었던 물건을 바닥에 아무렇게나 놓았어요,I went into the house and carelessly put the things I was holding on the floor
나이가 먹으면 정원을 가꾸는 것은 좋은 운동이에요,When you get older gardening is good exercise
우리는 옛날에 우리 집에서 채소를 가꿨어요,A long time ago we grew vegetables at our house
여자들이 파티에 가기 전에 예쁘게 가꿨어요,Before going to the party the girls dressed themselves up nicely
일주일 후에 데이트를 할 거라서 지금부터 외모를 가꿔야 돼요,I have a date in a week so I need to start taking care of my appearance
할아버지가 연세가 많아서 걷기가 힘들어요,Grandpa is old so it is hard for him to walk
할아버지가 연세가 드셔서 걷기가 힘들어요,Grandpa is old so it is hard for him to walk
연세가 어떻게 되세요?,How old are you?
저는 어제 선생님의 할아버지를 뵈었어요,I saw your grandpa yesterday
나는 어제 너의 할아버지를 뵈었어,I saw your grandpa yesterday
내일 뵙겠습니다,See you tomorrow
나중에 뵙겠습니다,See you later
그 여자의 옷차림이 아주 예뻐요,That woman's outfit is very pretty
그는 잠옷 차림으로 밖에 나갔어요,He went outside wearing pajamas
저는 매일 교복 차림으로 학교에 갔어요,I went to school every day wearing my uniform
면접을 보러 정장 차림으로 들어오는 사람이 많아요,Many people come in wearing suits for interviews
운동복 차림으로 교회에 들어가서는 안 됩니다,You should not enter church wearing exercise clothes
그녀는 자기 남자 친구에게 그녀의 집에서 나가라고 했어요 즉 그들은 헤어졌어요,She told her boyfriend to leave her house in other words they broke up
날씨가 매우 추웠을 때 즉 지난 겨울에 나무가 다 죽어버렸어요,When the weather was very cold that is last winter all the trees died
엄마가 전화를 갑자기 끊었어요 즉 저랑 통화하기 싫어하는 것 같아요,Mom suddenly hung up the phone in other words she does not want to talk to me
